{
  "$schema": "http://json-schema.org/draft-07/schema#",
  "$id": "https://zardui.com/schema/registry-item.json",
  "title": "zard/ui registry item",
  "description": "One item of a registry, published at /r/<name>.json. This is the file with the source code in it; the index at /r/registry.json lists the same items without their contents.",
  "type": "object",
  "required": ["name", "type", "files"],
  "properties": {
    "$schema": { "type": "string" },
    "name": { "type": "string" },
    "type": { "type": "string", "examples": ["registry:component"] },
    "basePath": {
      "type": "string",
      "description": "The directory the files are written into, when it differs from the item's name."
    },
    "dependencies": {
      "type": "array",
      "items": { "type": "string" },
      "description": "npm packages the item needs at runtime."
    },
    "devDependencies": { "type": "array", "items": { "type": "string" } },
    "registryDependencies": {
      "type": "array",
      "items": { "type": "string" },
      "description": "Other items of this registry that must be installed alongside."
    },
    "build": { "$ref": "#/definitions/build" },
    "minAngularMajor": {
      "type": "integer",
      "description": "The lowest Angular major the item's source compiles on. `zard-cli add` stops with a message on an older project instead of installing files that do not build."
    },
    "icons": { "$ref": "#/definitions/icons" },
    "files": {
      "type": "array",
      "description": "The files to write, with their contents. Paths are relative to the item's directory in the target project.",
      "items": {
        "type": "object",
        "required": ["name", "content"],
        "properties": {
          "name": { "type": "string" },
          "content": { "type": "string" }
        },
        "additionalProperties": false
      }
    }
  },
  "additionalProperties": false,
  "definitions": {
    "build": {
      "type": "object",
      "description": "What the item needs from the project's build, beyond npm packages and its own files. `zard-cli add` applies it: it wires the global stylesheet and the build assets of the project, and prints the snippet to paste where it cannot edit the file.",
      "properties": {
        "styles": {
          "type": "array",
          "description": "Imports the global stylesheet needs, in this order and unlayered.",
          "items": {
            "oneOf": [
              {
                "type": "object",
                "required": ["import"],
                "properties": {
                  "import": {
                    "type": "string",
                    "description": "A specifier resolved from node_modules, e.g. maplibre-gl/dist/maplibre-gl.css."
                  }
                },
                "additionalProperties": false
              },
              {
                "type": "object",
                "required": ["file"],
                "properties": {
                  "file": {
                    "type": "string",
                    "description": "One of the item's own files, imported by its path relative to the stylesheet."
                  }
                },
                "additionalProperties": false
              }
            ]
          }
        },
        "assets": {
          "type": "array",
          "description": "Static files the build copies to the output root, in the shape of an Angular build assets entry.",
          "items": {
            "type": "object",
            "required": ["glob", "input", "output"],
            "properties": {
              "glob": { "type": "string" },
              "input": { "type": "string", "description": "Relative to the workspace root." },
              "output": { "type": "string" }
            },
            "additionalProperties": false
          }
        }
      },
      "additionalProperties": false
    },
    "icons": {
      "type": "object",
      "required": ["family", "symbols", "tokens", "demos"],
      "description": "The icons the component draws, and the set they are written in. Present on every item; the lists come back empty for a component that draws none, which is how 'uses no icons' is told apart from 'published before this field existed'.",
      "properties": {
        "family": {
          "type": "string",
          "description": "The icon set the published files are written in. A client installing with another set translates the symbols using /r/icons.json."
        },
        "symbols": {
          "type": "array",
          "items": { "type": "string" },
          "description": "The identifiers as they appear in the code (lucideCheck). These are the ones that get installed, and what decides whether the ng-icons packages are needed."
        },
        "tokens": {
          "type": "array",
          "items": { "type": "string" },
          "description": "The same icons by the set-neutral key of the translation table (check)."
        },
        "demos": {
          "type": "object",
          "description": "The icons that only appear in the documentation examples. Half the components that use an icon only use it there, so they are mapped too — but they install nothing and are left out of the index.",
          "required": ["symbols", "tokens"],
          "properties": {
            "symbols": { "type": "array", "items": { "type": "string" } },
            "tokens": { "type": "array", "items": { "type": "string" } }
          },
          "additionalProperties": false
        }
      },
      "additionalProperties": false
    }
  }
}
