{
  "$schema": "https://zardui.com/schema/registry-item.json",
  "name": "spinner",
  "type": "registry:component",
  "files": [
    {
      "name": "spinner.component.ts",
      "content": "import {\n  ChangeDetectionStrategy,\n  Component,\n  computed,\n  input,\n  type TemplateRef,\n  ViewEncapsulation,\n} from '@angular/core';\n\nimport type { ClassValue } from 'clsx';\n\nimport { ZardStringTemplateOutletDirective } from '@/shared/core/directives/string-template-outlet/string-template-outlet.directive';\nimport { mergeClasses } from '@/shared/utils/merge-classes';\n\n@Component({\n  selector: 'z-spinner',\n  imports: [ZardStringTemplateOutletDirective],\n  template: `\n    @let icon = zIcon();\n    @if (icon) {\n      <ng-container *zStringTemplateOutlet=\"icon; context: iconContext()\" />\n    } @else {\n      <svg\n        data-slot=\"spinner\"\n        xmlns=\"http://www.w3.org/2000/svg\"\n        viewBox=\"0 0 24 24\"\n        fill=\"none\"\n        stroke=\"currentColor\"\n        stroke-width=\"2\"\n        stroke-linecap=\"round\"\n        stroke-linejoin=\"round\"\n        [class]=\"classes()\"\n      >\n        <path d=\"M21 12a9 9 0 1 1-6.219-8.56\" />\n      </svg>\n    }\n  `,\n  changeDetection: ChangeDetectionStrategy.OnPush,\n  encapsulation: ViewEncapsulation.None,\n  host: {\n    class: 'inline-flex',\n    role: 'status',\n    'aria-label': 'Loading',\n  },\n  exportAs: 'zSpinner',\n})\nexport class ZardSpinnerComponent {\n  readonly class = input<ClassValue>('');\n  readonly zIcon = input<TemplateRef<{ $implicit: string }> | undefined>(undefined);\n\n  protected readonly classes = computed(() => mergeClasses('size-4 animate-spin', this.class()));\n  protected readonly iconContext = computed(() => ({ $implicit: this.classes() }));\n}\n"
    },
    {
      "name": "index.ts",
      "content": "export * from './spinner.component';\n"
    }
  ],
  "icons": {
    "family": "lucide",
    "symbols": [],
    "tokens": [],
    "demos": {
      "symbols": [
        "lucideArrowUp"
      ],
      "tokens": [
        "arrow-up"
      ]
    }
  }
}
