{
  "$schema": "https://zardui.com/schema/registry-item.json",
  "name": "map-style-select",
  "type": "registry:component",
  "files": [
    {
      "name": "map-style-select.component.ts",
      "content": "import {\n  afterNextRender,\n  ChangeDetectionStrategy,\n  Component,\n  computed,\n  ElementRef,\n  inject,\n  input,\n  linkedSignal,\n  output,\n  signal,\n  viewChild,\n  ViewEncapsulation,\n} from '@angular/core';\n\nimport { NgIcon, provideIcons } from '@ng-icons/core';\nimport { lucideKeyRound } from '@ng-icons/lucide';\nimport type { ClassValue } from 'clsx';\n\nimport { ZardButtonComponent } from '@/shared/components/button/button.component';\nimport { ZardInputComponent } from '@/shared/components/input/input.component';\nimport { ZARD_MAP_STYLE_CONFIG, ZardMapStyleService } from '@/shared/components/map/map-style.service';\nimport { ZARD_MAP_PROVIDERS, type ZardMapPreset, type ZardMapProviderInfo } from '@/shared/components/map/map-styles';\nimport { ZardSelectImports } from '@/shared/components/select/select.imports';\nimport { mergeClasses } from '@/shared/utils/merge-classes';\n\nimport { mapStyleSelectVariants, mapStyleSwatchVariants } from './map-style-select.variants';\n\nlet nextId = 0;\n\ninterface MapStyleGroup {\n  readonly provider: ZardMapProviderInfo;\n  readonly presets: readonly ZardMapPreset[];\n}\n\n/**\n * Picks the basemap of every map on the page, live. It lists the presets of `ZardMapStyleService` grouped by provider,\n * with a swatch per style, and asks for an API key inline when a key-based preset is picked. Drop it in a toolbar, an\n * app header or over a map corner. It only has an effect where `provideZardMap()` is registered.\n */\n@Component({\n  selector: 'z-map-style-select',\n  imports: [ZardSelectImports, ZardButtonComponent, ZardInputComponent, NgIcon],\n  template: `\n    <z-select\n      [(zValue)]=\"selected\"\n      [zLabel]=\"triggerLabel()\"\n      zPosition=\"popper\"\n      zAlign=\"start\"\n      (zSelectionChange)=\"onSelect($event)\"\n    >\n      @for (group of groups(); track group.provider.id; let last = $last) {\n        <z-select-group>\n          <z-select-label>{{ group.provider.label }}</z-select-label>\n          @for (preset of group.presets; track preset.id) {\n            <z-select-item [zValue]=\"preset.id\">\n              <span class=\"flex items-center gap-2\">\n                <span aria-hidden=\"true\" [class]=\"swatchClasses\" [style.background]=\"swatch(preset)\"></span>\n                {{ preset.label }}\n                @if (preset.requiresKey) {\n                  <ng-icon name=\"lucideKeyRound\" class=\"text-muted-foreground size-3\" aria-hidden=\"true\" />\n                }\n                @if (preset.devOnly) {\n                  <span class=\"text-muted-foreground text-xs\">dev only</span>\n                }\n              </span>\n            </z-select-item>\n          }\n        </z-select-group>\n        @if (!last) {\n          <z-select-separator />\n        }\n      }\n    </z-select>\n\n    @if (pending(); as preset) {\n      <form\n        class=\"bg-muted/40 flex flex-col gap-2 rounded-lg border p-3\"\n        (submit)=\"applyKey($event)\"\n        (keydown.escape)=\"cancel()\"\n      >\n        <label class=\"text-xs font-medium\" [for]=\"inputId\">{{ providerOf(preset).label }} API key</label>\n        <div class=\"flex gap-2\">\n          <input\n            #keyInput\n            z-input\n            type=\"password\"\n            autocomplete=\"off\"\n            spellcheck=\"false\"\n            placeholder=\"Paste your key\"\n            [id]=\"inputId\"\n            [attr.aria-describedby]=\"hintId\"\n            [attr.aria-invalid]=\"invalid() ? 'true' : null\"\n          />\n          <button z-button zSize=\"sm\" type=\"submit\">Apply</button>\n          <button z-button zSize=\"sm\" zType=\"ghost\" type=\"button\" (click)=\"cancel()\">Cancel</button>\n        </div>\n        <p class=\"text-muted-foreground text-xs\" [id]=\"hintId\">\n          {{ preset.label }} needs a key. It is only used to request tiles from {{ providerOf(preset).label }} and stays\n          in this browser.\n          @if (providerOf(preset).keyUrl; as keyUrl) {\n            <a\n              class=\"text-foreground underline underline-offset-4\"\n              target=\"_blank\"\n              rel=\"noopener noreferrer\"\n              [href]=\"keyUrl\"\n            >\n              Get a key\n            </a>\n          }\n        </p>\n      </form>\n    }\n  `,\n  changeDetection: ChangeDetectionStrategy.OnPush,\n  encapsulation: ViewEncapsulation.None,\n  viewProviders: [provideIcons({ lucideKeyRound })],\n  host: {\n    'data-slot': 'map-style-select',\n    role: 'group',\n    '[attr.aria-label]': 'zAriaLabel()',\n    '[class]': 'classes()',\n  },\n  exportAs: 'zMapStyleSelect',\n})\nexport class ZardMapStyleSelectComponent {\n  private readonly service = inject(ZardMapStyleService);\n  private readonly keyInput = viewChild('keyInput', { read: ElementRef<HTMLInputElement> });\n\n  readonly class = input<ClassValue>('');\n  readonly zAriaLabel = input('Map style');\n\n  /** Emits the preset that is now in use, after a pick (and, for a key-based one, after its key was accepted). */\n  readonly zStyleChange = output<ZardMapPreset>();\n\n  protected readonly inputId = `z-map-style-key-${nextId++}`;\n  protected readonly hintId = `${this.inputId}-hint`;\n  protected readonly swatchClasses = mapStyleSwatchVariants({ zSize: 'default' });\n  protected readonly classes = computed(() => mergeClasses(mapStyleSelectVariants(), this.class()));\n\n  protected readonly pending = signal<ZardMapPreset | null>(null);\n  protected readonly invalid = signal(false);\n  /** Bound two-way to the select, and put back to the preset in use when a pick had to wait for a key. */\n  protected readonly selected = linkedSignal<string | string[]>(() => this.service.presetId());\n\n  protected readonly groups = computed<readonly MapStyleGroup[]>(() => {\n    const presets = this.service.presets();\n\n    return ZARD_MAP_PROVIDERS.map(provider => ({\n      provider,\n      presets: presets.filter(preset => preset.provider === provider.id),\n    })).filter(group => group.presets.length > 0);\n  });\n\n  /** \"Carto · Positron\": the preset name alone is ambiguous, two providers ship a Positron. */\n  protected readonly triggerLabel = computed(() => {\n    const preset = this.service.preset();\n    return `${this.providerOf(preset).label} · ${preset.label}`;\n  });\n\n  constructor() {\n    // The picker can render before any map does; reading the stored choice here keeps it from flashing the default.\n    this.service.configure(inject(ZARD_MAP_STYLE_CONFIG, { optional: true }) ?? {});\n\n    afterNextRender(() => this.keyInput()?.nativeElement.focus());\n  }\n\n  protected providerOf(preset: ZardMapPreset): ZardMapProviderInfo {\n    return ZARD_MAP_PROVIDERS.find(provider => provider.id === preset.provider) ?? ZARD_MAP_PROVIDERS[0];\n  }\n\n  protected swatch(preset: ZardMapPreset): string {\n    const { light, dark } = preset.swatch;\n    return light === dark ? light : `linear-gradient(135deg, ${light} 50%, ${dark} 50%)`;\n  }\n\n  protected onSelect(value: string | string[]): void {\n    const id = Array.isArray(value) ? value[0] : value;\n    this.invalid.set(false);\n\n    const result = this.service.select(id);\n    if (result === 'selected') {\n      this.pending.set(null);\n      this.zStyleChange.emit(this.service.preset());\n      return;\n    }\n\n    // Nothing changed: the maps keep their basemap until the key arrives. Put the select back where the maps are.\n    this.selected.set(this.service.presetId());\n    if (result === 'needs-key') {\n      this.pending.set(this.service.presets().find(preset => preset.id === id) ?? null);\n      queueMicrotask(() => this.keyInput()?.nativeElement.focus());\n    }\n  }\n\n  protected applyKey(event: Event): void {\n    event.preventDefault();\n    const preset = this.pending();\n    if (!preset) {\n      return;\n    }\n\n    const key = this.keyInput()?.nativeElement.value ?? '';\n    if (!key.trim()) {\n      this.invalid.set(true);\n      return;\n    }\n\n    if (this.service.select(preset.id, key) === 'selected') {\n      this.pending.set(null);\n      this.invalid.set(false);\n      this.selected.set(this.service.presetId());\n      this.zStyleChange.emit(this.service.preset());\n    }\n  }\n\n  protected cancel(): void {\n    this.pending.set(null);\n    this.invalid.set(false);\n  }\n}\n"
    },
    {
      "name": "map-style-select.variants.ts",
      "content": "import { cva, type VariantProps } from 'class-variance-authority';\n\nexport const mapStyleSelectVariants = cva('flex w-full min-w-48 flex-col gap-2');\n\nexport const mapStyleSwatchVariants = cva(\n  'inline-block shrink-0 rounded-full border border-black/15 dark:border-white/20',\n  {\n    variants: {\n      zSize: {\n        sm: 'size-3',\n        default: 'size-4',\n      },\n    },\n    defaultVariants: {\n      zSize: 'default',\n    },\n  },\n);\n\nexport type ZardMapStyleSwatchSizeVariants = NonNullable<VariantProps<typeof mapStyleSwatchVariants>['zSize']>;\n"
    },
    {
      "name": "index.ts",
      "content": "export * from './map-style-select.component';\nexport * from './map-style-select.variants';\n"
    }
  ],
  "registryDependencies": [
    "button",
    "input",
    "map",
    "select"
  ],
  "icons": {
    "family": "lucide",
    "symbols": [
      "lucideKeyRound"
    ],
    "tokens": [
      "key-round"
    ],
    "demos": {
      "symbols": [],
      "tokens": []
    }
  }
}
