{
  "$schema": "https://zardui.com/schema/registry-item.json",
  "name": "utils",
  "type": "registry:component",
  "files": [
    {
      "name": "index.ts",
      "content": "export * from './merge-classes';\nexport * from './noop';\nexport * from './number';\n"
    },
    {
      "name": "merge-classes.ts",
      "content": "import { type ClassValue, clsx } from 'clsx';\nimport { twMerge } from 'tailwind-merge';\n\nexport type { ClassValue };\n\n/** Merges CVA variants with a consumer's `class` input, last write winning. */\nexport function mergeClasses(...inputs: ClassValue[]): string {\n  return twMerge(clsx(inputs));\n}\n"
    },
    {
      "name": "noop.ts",
      "content": "/** Does nothing. Used as the initial value of a ControlValueAccessor callback. */\nexport const noopFn = (): void => void 0;\n"
    },
    {
      "name": "number.ts",
      "content": "function clamp(value: number, [min, max]: [number, number]): number {\n  return Math.min(max, Math.max(min, value));\n}\n\nfunction roundToStep(value: number, min: number, step: number): number {\n  return Math.round((value - min) / step) * step + min;\n}\n\nfunction convertValueToPercentage(value: number, min: number, max: number): number {\n  return ((value - min) / (max - min)) * 100;\n}\n\nexport { clamp, roundToStep, convertValueToPercentage };\n"
    }
  ],
  "basePath": "utils",
  "dependencies": [
    "tailwind-merge",
    "clsx"
  ],
  "icons": {
    "family": "lucide",
    "symbols": [],
    "tokens": [],
    "demos": {
      "symbols": [],
      "tokens": []
    }
  }
}
